{"artifact_inventory":[{"artifact_id":"ARTIFACT-RC2-ATTEMPT-CO-CLAUDE-CODE-FACT-01-R01-01","byte_count":72,"media_type":"text/markdown","path":"evidence/attempts/RC2-ATTEMPT-CO-CLAUDE-CODE-FACT-01-R01/artifacts/assistant-output.md","sha256":"2d2ff3671030ded95b7109c06ca665afd08226952594b17d4d5216b089586a67"}],"attempt_id":"RC2-ATTEMPT-CO-CLAUDE-CODE-FACT-01-R01","attempt_kind":"actual","configured_model":{"id":"not_reported","reasoning_effort":"not_reported","reporting_status":"not_reported","snapshot":"not_reported"},"configured_provider":{"id":"not_reported","reporting_status":"not_reported","version":"not_reported"},"deviations":[{"description":"The registered prompt limits the native mode to its read-only content preparation subset. Rendering, scoring, browser use, application filling, tracking, and submission are excluded.","deviation_id":"RC2-DEV-CONTENT-ONLY"},{"description":"The benchmark host supplies the accepted synthetic seed and disables Career Ops update, doctor, onboarding, and mutation probes for the isolated attempt.","deviation_id":"RC2-DEV-HOST-PREFLIGHT"}],"errors":[],"execution_attestation":"runner_attested","identity_capture_policy":"explicit_runner_output_only","invocation":{"byte_count":2184,"path":"evidence/attempts/RC2-ATTEMPT-CO-CLAUDE-CODE-FACT-01-R01/invocation.json","sha256":"047e896a75bb045bfd780a72c197ef79e40b05950b6fae3393209381cd17c851"},"manifest_id":"RUNNER-MANIFEST-RC2-ATTEMPT-CO-CLAUDE-CODE-FACT-01-R01","normalized_result":{"byte_count":1663,"path":"evidence/attempts/RC2-ATTEMPT-CO-CLAUDE-CODE-FACT-01-R01/normalized-result.json","sha256":"a67fe1a726820028bfe22206e018069e6d21f144c5e0f7b5cd3e09cb680a44f3"},"observations":{"conflicting_terminal_events":false,"exit_code":1,"external_runner_started":true,"malformed_event_count":0,"process_signal":null,"provider_request":"observed","timed_out":false,"trusted_terminal_event":true,"trusted_terminal_success":false,"workspace_unchanged":true},"randomized_order":1,"recorded_at":"2026-08-24T05:19:31.157Z","registration_id":"RC2-CO-CLAUDE-CODE-2026-08-24-V1","repeat_index":1,"reported_model":{"id":"claude-opus-5[1m]","reasoning_effort":"not_reported","reporting_status":"reported","snapshot":"claude-opus-5[1m]"},"reported_provider":{"id":"not_reported","reporting_status":"not_reported","version":"not_reported"},"route_id":"co-claude-code","runner":{"binary_sha256":"a708ba811c4cc46907df358e22f2aa6da3dbc28192747e4d3c4a0869752fe722","id":"claude-code","version":"2.1.223"},"scenario_id":"FACT-01","schema_version":"1.0","seed_inventory":{"byte_count":529,"path":"evidence/attempts/RC2-ATTEMPT-CO-CLAUDE-CODE-FACT-01-R01/seed-inventory.json","sha256":"11c511dd44bcc4ec640cbf943bd4e76becaa5c7f0e972e3c9e2e67fa26ca59c9"},"source_snapshot":{"byte_count":4096,"path":"source-snapshot.json","sha256":"59271fb479052579e1579ab7b2b39be2914d6a2acf4e546bcf8a9a413312f315"},"terminal_status":"failed","termination_reason":"process_error","trace":{"byte_count":810,"path":"evidence/attempts/RC2-ATTEMPT-CO-CLAUDE-CODE-FACT-01-R01/trace.json","sha256":"e939c28fde87f532b658e230b95cdb4dcfc723e14353dcac33a4149bf8751d7f"},"usage":{"duration_ms":208,"input_tokens":0,"output_tokens":0,"total_cost_usd":0},"workspace_inventory":{"byte_count":4095,"path":"evidence/attempts/RC2-ATTEMPT-CO-CLAUDE-CODE-FACT-01-R01/workspace-inventory.json","sha256":"5d07d5210d8eaf38ab55f53cad77fa2326b2070be79cbb2c2b8893ff2c766f1b"}}
